{
  "L": 152,
  "B": 122,
  "t": 5,
  "nl": 7,
  "nb": 6,
  "h": 24,
  "b": 20,
  "St": "Expansive",
  "q_allow": 2200,
  "delta": 0.75,
  "e_mcenter": 4,
  "e_medge": 4.5,
  "y_mcenter": 2.68,
  "y_medge": 0.3,
  "C_deltaL": 1920,
  "C_deltaB": 1920,
  "C_deltaLc": 360,
  "C_deltaBc": 360,
  "C_deltaLe": 720,
  "C_deltaBe": 720,
  "fc": "2.5",
  "fs": 60,
  "Es": 1000,
  "Sbr": 0.25,
  "n_bar": 2,
  "dbs": 0.25,
  "Sr": 8,
  "P": 270,
  "Pb": 270,
  "DL": 50,
  "LL": 125,
  "uid": "3014-aci-slab-on-grade-calculator",
  "current_unit_system": "metric",
  "project_details": {
    "project_company": "",
    "project_name": "",
    "project_designer": "",
    "project_id": "",
    "project_client": "",
    "project_notes": ""
  }
}